adult,backdrop_path,genre_ids,id,original_language,original_title,overview,popularity,poster_path,release_date,title,video,vote_average,vote_count
False,/gMQibswELoKmB60imE7WFMlCuqY.jpg,"[27, 53, 9648]",1034541,en,Terrifier 3,"Five years after surviving Art the Clown's Halloween massacre, Sienna and Jonathan are still struggling to rebuild their shattered lives. As the holiday season approaches, they try to embrace the Christmas spirit and leave the horrors of the past behind. But just when they think they're safe, Art returns, determined to turn their holiday cheer into a new nightmare. The festive season quickly unravels as Art unleashes his twisted brand of terror, proving that no holiday is safe.",6883.159,/63xYQj1BwRFielxsBDXvHIJyXVm.jpg,2024-10-09,Terrifier 3,False,7.3,586
False,/3V4kLQg0kSqPLctI5ziYWabAZYF.jpg,"[878, 28, 12]",912649,en,Venom: The Last Dance,"Eddie and Venom are on the run. Hunted by both of their worlds and with the net closing in, the duo are forced into a devastating decision that will bring the curtains down on Venom and Eddie's last dance.",5590.757,/k42Owka8v91trK1qMYwCQCNwJKr.jpg,2024-10-22,Venom: The Last Dance,False,6.72,473
False,/4zlOPT9CrtIX05bBIkYxNZsm5zN.jpg,"[16, 878, 10751]",1184918,en,The Wild Robot,"After a shipwreck, an intelligent robot called Roz is stranded on an uninhabited island. To survive the harsh environment, Roz bonds with the island's animals and cares for an orphaned baby goose.",4321.421,/wTnV3PCVW5O92JMrFvvrRcV39RU.jpg,2024-09-12,The Wild Robot,False,8.5,2373
False,/oPUOpnl3pqD8wuidjfUn17mO1yA.jpg,"[16, 878, 12, 10751]",698687,en,Transformers One,"The untold origin story of Optimus Prime and Megatron, better known as sworn enemies, but once were friends bonded like brothers who changed the fate of Cybertron forever.",2550.704,/iHPIBzrjJHbXeY9y7VVbEVNt7LW.jpg,2024-09-11,Transformers One,False,8.2,530
False,/9oYdz5gDoIl8h67e3ccv3OHtmm2.jpg,"[18, 27, 878]",933260,en,The Substance,"Have you ever dreamt of a better version of yourself? You, only better in every way. You should try this new product, it's called The Substance. IT CHANGED MY LIFE.",2881.789,/lqoMzCcZYEFK729d6qzt349fB4o.jpg,2024-09-07,The Substance,False,7.319,1370
False,/uGmYqxh8flqkudioyFtD7IJSHxK.jpg,"[18, 80, 53]",889737,en,Joker: Folie à Deux,"While struggling with his dual identity, Arthur Fleck not only stumbles upon true love, but also finds the music that's always been inside him.",2614.505,/if8QiqCI7WAGImKcJCfzp6VTyKA.jpg,2024-10-01,Joker: Folie à Deux,False,5.688,1339
False,/6vn6K9oX82i6E86ZiHVxqVEMQqP.jpg,"[878, 27]",945961,en,Alien: Romulus,"While scavenging the deep ends of a derelict space station, a group of young space colonizers come face to face with the most terrifying life form in the universe.",1992.724,/b33nnKl1GSFbao4l3fZDDqsMx0F.jpg,2024-08-13,Alien: Romulus,False,7.3,2130
False,/p5ozvmdgsmbWe0H8Xk7Rc8SCwAB.jpg,"[16, 10751, 12, 35, 18]",1022789,en,Inside Out 2,"Teenager Riley's mind headquarters is undergoing a sudden demolition to make room for something entirely unexpected: new Emotions! Joy, Sadness, Anger, Fear and Disgust, who’ve long been running a successful operation by all accounts, aren’t sure how to feel when Anxiety shows up. And it looks like she’s not alone.",1676.036,/vpnVM9B6NMmQpWeZvzLvDESb2QY.jpg,2024-06-11,Inside Out 2,False,7.6,4590
False,/VuukZLgaCrho2Ar8Scl9HtV3yD.jpg,"[878, 28]",335983,en,Venom,"Investigative journalist Eddie Brock attempts a comeback following a scandal, but accidentally becomes the host of Venom, a violent, super powerful alien symbiote. Soon, he must rely on his newfound powers to protect the world from a shadowy organization looking for a symbiote of their own.",1917.653,/2uNW4WbgBXL25BAbXGLnLqX71Sw.jpg,2018-09-28,Venom,False,6.835,15878
False,/llIXQAndg5kB6SWlp6ouUdO7Zxd.jpg,"[12, 36, 28, 18, 10749, 53]",1084736,fr,Le Comte de Monte-Cristo,"Edmond Dantes becomes the target of a sinister plot and is arrested on his wedding day for a crime he did not commit. After 14 years in the island prison of Château d’If, he manages a daring escape. Now rich beyond his dreams, he assumes the identity of the Count of Monte-Cristo and exacts his revenge on the three men who betrayed him.",2126.371,/r7iCXrXmq4hKpB4QfDzZd8vsJ7l.jpg,2024-06-28,The Count of Monte-Cristo,False,8.3,732
False,/yDHYTfA3R0jFYba16jBB1ef8oIt.jpg,"[28, 35, 878]",533535,en,Deadpool & Wolverine,"A listless Wade Wilson toils away in civilian life with his days as the morally flexible mercenary, Deadpool, behind him. But when his homeworld faces an existential threat, Wade must reluctantly suit-up again with an even more reluctant Wolverine.",1885.377,/8cdWjvZQUExUUTzyp4t6EDMubfO.jpg,2024-07-24,Deadpool & Wolverine,False,7.707,5027
False,/vIgyYkXkg6NC2whRbYjBD7eb3Er.jpg,"[878, 28, 12]",580489,en,Venom: Let There Be Carnage,"After finding a host body in investigative reporter Eddie Brock, the alien symbiote must face a new enemy, Carnage, the alter ego of serial killer Cletus Kasady.",1488.305,/1MJNcPZy46hIy2CmSqOeru0yr5C.jpg,2021-09-30,Venom: Let There Be Carnage,False,6.799,10102
False,/askg3SMvhqEl4OL52YuvdtY40Yb.jpg,"[10751, 16, 10402, 12]",354912,en,Coco,"Despite his family’s baffling generations-old ban on music, Miguel dreams of becoming an accomplished musician like his idol, Ernesto de la Cruz. Desperate to prove his talent, Miguel finds himself in the stunning and colorful Land of the Dead following a mysterious chain of events. Along the way, he meets charming trickster Hector, and together, they set off on an extraordinary journey to unlock the real story behind Miguel's family history.",1121.64,/gGEsBPAijhVUFoiNpgZXqRVWJt2.jpg,2017-10-27,Coco,False,8.2,19388
False,/9s9o9RT9Yj6nDuRJjnJm78WFoFl.jpg,"[28, 27, 53, 878]",1051896,en,Arcadian,"In the near future, on a decimated Earth, Paul and his twin sons face terror at night when ferocious creatures awaken. When Paul is nearly killed, the boys come up with a plan for survival, using everything their father taught them to keep him alive.",1844.021,/spWV1eRzlDxvai8LbxwAWR0Vst4.jpg,2024-04-12,Arcadian,False,6.0,382
False,/uLqNGzJwnj8JKkKuRM2dHWJKCtc.jpg,"[28, 27, 53]",1029235,en,Azrael,"In a world where no one speaks, a devout female hunts down a young woman who has escaped her imprisonment. Recaptured by its ruthless leaders, Azrael is due to be sacrificed to pacify an ancient evil deep within the surrounding wilderness.",1063.12,/qpdFKDvJS7oLKTcBLXOaMwUESbs.jpg,2024-09-27,Azrael,False,6.149,114
False,/lgkPzcOSnTvjeMnuFzozRO5HHw1.jpg,"[16, 10751, 35, 28]",519182,en,Despicable Me 4,"Gru and Lucy and their girls—Margo, Edith and Agnes—welcome a new member to the Gru family, Gru Jr., who is intent on tormenting his dad. Gru also faces a new nemesis in Maxime Le Mal and his femme fatale girlfriend Valentina, forcing the family to go on the run.",1225.064,/wWba3TaojhK7NdycRhoQpsG0FaH.jpg,2024-06-20,Despicable Me 4,False,7.113,2108
False,/csQSGH0QU8D3Ov5YLEYuHep8ihA.jpg,"[53, 12, 28, 878]",1196470,fr,Survivre,A couple celebrates their son’s birthday in the middle of the ocean on their boat. A violent storm hits and it brings up hungry creatures from the depths and they fight for their survival.,1262.118,/7fR3KxswtY8OHHZuOUB9td58CRX.jpg,2024-06-19,Survive,False,5.0,36
False,/naNXYdBzTEb1KwOdi1RbBkM9Zv1.jpg,"[27, 53]",420634,en,Terrifier,A maniacal clown named Art terrorizes three young women on Halloween night and everyone else who stands in his way.,1298.546,/sFaPj5UyIAsiRuIgVl60pCYUzmR.jpg,2018-01-25,Terrifier,False,6.4,2343
False,/begseNUKhZcc05Bc1UggaX5GeES.jpg,"[28, 53, 80]",976734,en,Canary Black,"Top level CIA agent Avery Graves is blackmailed by terrorists into betraying her own country to save her kidnapped husband. Cut off from her team, she turns to her underworld contacts to survive and help locate the coveted intelligence that the kidnappers want.",1301.295,/hhiR6uUbTYYvKoACkdAIQPS5c6f.jpg,2024-10-10,Canary Black,False,6.4,171
False,/9msuazXGWAyl7vhxVFU7e7Bb5Ik.jpg,"[18, 10749]",179387,tl,Heavenly Touch,"Jonard is having trouble making ends meet. His mother is suffering from depression, and he and his sister are forced to quit school in order to take care of her. One day, Jonard meets up his friend Rodel, and Rodel introduces him to the world of massage parlors. Rodel teaches him massage, and brings him to Heavenly Touch, a syndicate-run massage parlor that mostly caters to homosexuals.",1028.191,/ory8WuAqznTE7lfopTSymHpop2t.jpg,2009-05-12,Heavenly Touch,False,6.3,21
False,/6Rjsm5khNaYa4Gnw4iHnGX2E34T.jpg,"[27, 53]",1063877,en,Don't Move,"A grieving woman in a secluded forest encounters a killer who injects her with a paralytic drug. As her body shuts down, her fight for survival begins.",1014.001,/cRDJxdnRb7ikKd6fVJTrGeaL34v.jpg,2024-10-24,Don't Move,False,6.517,360
False,/xi1VSt3DtkevUmzCx2mNlCoDe74.jpg,"[35, 14, 27]",917496,en,Beetlejuice Beetlejuice,"After a family tragedy, three generations of the Deetz family return home to Winter River. Still haunted by Betelgeuse, Lydia's life is turned upside down when her teenage daughter, Astrid, accidentally opens the portal to the Afterlife.",976.081,/kKgQzkUCnQmeTPkyIwHly2t6ZFI.jpg,2024-09-04,Beetlejuice Beetlejuice,False,7.154,1704
False,/cRdA9xjHBbobw4LJFsQ3j1CgpVq.jpg,"[27, 53]",663712,en,Terrifier 2,"A year after the Miles County massacre, Art the Clown is resurrected by a sinister entity. Art returns home, where he must hunt down and destroy teenage Sienna and her younger brother Jonathan on Halloween. As the body count rises, the siblings fight to stay alive while uncovering the true nature of Art's evil intent.",1060.271,/8gLhu8UFPZfH2Hv11JhTZkb9CVl.jpg,2022-10-06,Terrifier 2,False,6.763,1949
False,/zAqBIeO71BFL7bAtP5TFzVjVamy.jpg,"[10749, 18]",1079091,en,It Ends with Us,"When a woman's first love suddenly reenters her life, her relationship with a charming, but abusive neurosurgeon is upended, and she realizes she must learn to rely on her own strength to make an impossible choice for her future.",638.752,/AjV6jFJ2YFIluYo4GQf13AA1tqu.jpg,2024-08-07,It Ends with Us,False,7.2,970
False,/v23fWgJUEt8EMmvn19btIacxP8E.jpg,"[10749, 14, 16]",3933,en,Corpse Bride,"Set in a 19th-century European village, this stop-motion animation feature follows the story of Victor, a young man whisked away to the underworld and wed to a mysterious corpse bride, while his real bride Victoria waits bereft in the land of the living.",718.341,/isb2Qow76GpqYmsSyfdMfsYAjts.jpg,2005-09-12,Corpse Bride,False,7.58,9220
False,/rivlyJuBKNnSgzOU0GkEWIuawjt.jpg,"[28, 18, 53]",991610,nl,Invasie,"When neighboring country Veragua suddenly attacks Curaçao and Aruba, the Dutch government is taken completely by surprise. The conflict escalates rapidly. Three young Navy recruits must figure out what is the right thing to do.",703.683,/s2KE27j9cWDSJKYOg4KxXDwnoiv.jpg,2024-04-11,Invasion,False,4.9,9
False,/epQfhIcfqWgrMhRvnxkVm7EeEpE.jpg,"[878, 27]",1125510,es,El hoyo 2,"After a mysterious leader imposes his law in a brutal system of vertical cells, a new arrival battles against a dubious food distribution method.",732.488,/hf94ySIzdP3KwHau9VSWh7b7Qu2.jpg,2024-09-27,The Platform 2,False,5.652,781
False,/1U7EVGj7Noc26owNOreCTKn59Bd.jpg,[27],86328,en,Terrifier,"After witnessing a brutal murder on Halloween night, a young woman becomes the next target of a maniacal entity.",749.428,/uP5k78WkCVrxrFp4AJflHbC61Ao.jpg,2011-08-09,Terrifier,False,6.274,179
False,/hd1TvTUGjkoYoqvXYfSBpI5Ri9B.jpg,"[16, 28, 12, 878]",1159311,ja,僕のヒーローアカデミア THE MOVIE ユアネクスト,"In a society devastated by the effects of an all-out war between heroes and villains, a mysterious giant fortress suddenly appears, engulfing towns and people one after another. Then, a man reminiscent of All Might, the 'symbol of peace', stands in front of Izuku and his friends...",719.943,/8rdB1wkheEMMqcY8qLAKjCMPcnZ.jpg,2024-08-02,My Hero Academia: You're Next,False,6.8,43
False,/vOwezqxpHjBpA5nJIWbapm9Qtgd.jpg,"[28, 35, 80]",616446,en,Brothers,"A reformed criminal's attempt at going straight is derailed when he reunites with his sanity-testing twin brother on a road trip for the score of a lifetime. Dodging bullets, the law, and an overbearing mother along the way, they must heal their severed family bond before they end up killing each other.",718.142,/Akweo95FGyDpucYVT81h0SbX8Ky.jpg,2024-10-10,Brothers,False,6.269,145
False,/m1MifWpNjOU1g8UfIyNSI2dMFZf.jpg,"[16, 10751, 35, 27]",1371727,en,Sing: Thriller,"Buster Moon dreams up a star-studded spectacle set to Michael Jackson's ""Thriller"" in this animated short featuring characters from the hit ""Sing"" films.",791.279,/i77OInTKcrnRlAozFOaB6D5mk15.jpg,2024-10-16,Sing: Thriller,False,7.4,69
False,/edIAwcl5qGzx2jkY8p5GAemqQCx.jpg,[10749],721173,ko,착한 엄마 3,"Sun-young and Jun-young are living together. However, they have been unable to pay the rent for several months and listen to the pinzan from the landlord. Eventually, after worrying, he goes to Jun-young's father's house and asks for help. But there, the father's new lover, Ji-young, greets them. Sun-young and Jun-young are unable to borrow money and live in the house for the time being. But after that day. Jun-young's father Dae-woong's eyes keep seeing Sun-young's short mini skirt. Ji-young is interested in Jun-young, who is young and manly…",445.285,/s65C2cKJeqbHVQHPOaOcp7asdFv.jpg,2019-08-26,Good Mother 3,False,5.7,15
False,/mpMDztY5OmV7i4ypYpWgqsP4DHs.jpg,"[27, 53]",978796,en,Bagman,"For centuries and across cultures, parents have warned their children of the legendary Bagman, who snatches innocent children and stuffs them into his vile, rotting bag—never to be seen again. Patrick McKee narrowly escaped such an encounter as a boy, which left him with lasting scars throughout his adulthood. Now, Patrick’s childhood tormentor has returned, threatening the safety of his wife Karina and son Jake.",722.15,/hzrvol8K2VWm2BsDTwb8YvRMzIH.jpg,2024-09-20,Bagman,False,6.6,51
False,/cCBdL7v7msKHE0T5lPbaAY8GTJ5.jpg,[27],231001,en,All Hallows' Eve,"While watching two children on Halloween night, a babysitter finds an old VHS tape in the kids' trick or treat bag. The tape features three tales of terror, all linked together by a murderous clown.",642.315,/bSe8CBqK8HkbP6sqZWzcJfQV9Ci.jpg,2013-10-29,All Hallows' Eve,False,5.7,492
False,/Asg2UUwipAdE87MxtJy7SQo08XI.jpg,"[28, 14, 27]",957452,en,The Crow,"Soulmates Eric and Shelly are brutally murdered when the demons of her dark past catch up with them. Given the chance to save his true love by sacrificing himself, Eric sets out to seek merciless revenge on their killers, traversing the worlds of the living and the dead to put the wrong things right.",624.165,/58QT4cPJ2u2TqWZkterDq9q4yxQ.jpg,2024-08-21,The Crow,False,5.8,713
False,/tncbMvfV0V07UZozXdBEq4Wu9HH.jpg,"[28, 35]",573435,en,Bad Boys: Ride or Die,"After their late former Captain is framed, Lowrey and Burnett try to clear his name, only to end up on the run themselves.",621.905,/oGythE98MYleE6mZlGs5oBGkux1.jpg,2024-06-05,Bad Boys: Ride or Die,False,7.493,2292
False,/s3ioaDU8OudHWeg7rIbLyU33iXs.jpg,"[80, 53, 28]",1047373,en,The Silent Hour,"While working a case as an interpreter, a hearing-impaired police detective must confront a group of criminals trying to eliminate a deaf murder witness in her apartment building.",741.265,/j736cRzBtEPCm0nHnpRN1prqiqj.jpg,2024-10-03,The Silent Hour,False,6.347,49
False,/tCKWksaQI8XkAQLVou0AlGab5S6.jpg,"[28, 878]",1144962,en,Transmorphers: Mech Beasts,"20 years after the events of Transmorphers, a newer, more advanced species of alien robot descends on a rebuilt Earth, threatening once again to destroy the planet.",580.71,/oqhaffnQqSzdLrYAQA5W4IdAoCX.jpg,2023-06-09,Transmorphers: Mech Beasts,False,5.448,29
False,/3rxoUVI74z7rTWYSAC2q3Uax2nC.jpg,"[27, 9648]",1100782,en,Smile 2,"About to embark on a new world tour, global pop sensation Skye Riley begins experiencing increasingly terrifying and inexplicable events. Overwhelmed by the escalating horrors and the pressures of fame, Skye is forced to face her dark past to regain control of her life before it spirals out of control.",677.012,/aE85MnPIsSoSs3978Noo16BRsKN.jpg,2024-10-16,Smile 2,False,6.851,268
False,/bkENfmxUY3UYsRLizJAhF5IQPvS.jpg,"[28, 80, 53]",1025596,en,Blood for Dust,"Reckless Ricky makes serious money dealing illegal weapons throughout the tri-state area and loves to flaunt it. Traveling salesman Cliff, covers the same territory Ricky runs guns through. Desperate to find some financial relief for his struggling family, Cliff agrees to partner with Ricky, to commit cross-state drug and gun deliveries for a mid-level American cartel boss John. When a simple exchange turns into a bloodbath after Ricky kills everyone in a territory grab, the pair find themselves in a pressure cooker situation where unlikely drug dealer Cliff must fight as hard as he can to stay alive.",390.025,/nvaCnkl8RilLhVAQXPFei0tqkqW.jpg,2024-04-19,Blood for Dust,False,5.8,45
False,/bkENfmxUY3UYsRLizJAhF5IQPvS.jpg,"[28, 80, 53]",1025596,en,Blood for Dust,"Reckless Ricky makes serious money dealing illegal weapons throughout the tri-state area and loves to flaunt it. Traveling salesman Cliff, covers the same territory Ricky runs guns through. Desperate to find some financial relief for his struggling family, Cliff agrees to partner with Ricky, to commit cross-state drug and gun deliveries for a mid-level American cartel boss John. When a simple exchange turns into a bloodbath after Ricky kills everyone in a territory grab, the pair find themselves in a pressure cooker situation where unlikely drug dealer Cliff must fight as hard as he can to stay alive.",390.025,/nvaCnkl8RilLhVAQXPFei0tqkqW.jpg,2024-04-19,Blood for Dust,False,5.8,45
False,/aFDYcmwEWRiEh58Ri1tMpCUWPBp.jpg,"[10770, 10751, 35, 27, 16]",1354627,en,SpongeBob Squarepants: Kreepaway Kamp,"While at Kamp Koral for a reunion, SpongeBob and the gang are stalked by a mysterious figure lurking in the shadows as campers start disappearing one by one!",501.765,/blRsgsexoBqnjcEJkV8beKAVT6J.jpg,2024-10-10,SpongeBob Squarepants: Kreepaway Kamp,False,7.116,43
False,/hLYH6wbi3Mgscdv2KuYcTdWGlUV.jpg,"[80, 28]",824003,it,Diabolik chi sei?,"Captured by a ruthless gang of bank robbers, foes Diabolik and Ginko find themselves facing certain death. While Eva Kant and Altea forge an unlikely alliance to rescue their lovers, Diabolik reveals his mysterious past to the Inspector.",517.931,/1DAXwi4y941ryPoGbzUlFEEiPAo.jpg,2023-11-30,Diabolik - Who Are You?,False,6.3,96
False,/hPIWQT70wQK6akqfLXByEvr62u0.jpg,"[28, 53, 27, 878]",726139,ko,탈출: 프로젝트 사일런스,"Due to sudden deteriorating weather conditions, visibility on the Airport Bridge is severely impaired, leaving people stranded and at risk of the bridge collapsing due to a series of chain collisions and explosions. Amidst the chaos, the canine subjects ""Echo"" from the military experiment ""Project Silence,"" who were being transported in secret, break free, and all human survivors become targets of relentless attacks.",496.467,/fttoFfKikQMwIoV3UVvlCvBhbUw.jpg,2024-07-11,Project Silence,False,7.0,208
False,,"[18, 10749]",1149912,id,Kelas Bintang - Hot Moms,,476.356,/7dBqZmErtrxN9ghOJoW6SimgDo1.jpg,2023-02-09,Kelas Bintang - Hot Moms,False,6.0,3
False,/lntyt4OVDbcxA1l7LtwITbrD3FI.jpg,"[10749, 18]",1010581,es,Culpa mía,"Noah must leave her city, boyfriend, and friends to move into William Leister's mansion, the flashy and wealthy husband of her mother Rafaela. As a proud and independent 17 year old, Noah resists living in a mansion surrounded by luxury. However, it is there where she meets Nick, her new stepbrother, and the clash of their strong personalities becomes evident from the very beginning.",451.755,/w46Vw536HwNnEzOa7J24YH9DPRS.jpg,2023-06-08,My Fault,False,7.916,3022
False,/p4INKu77iuTG1o1a5N3Y9vqeEGq.jpg,"[27, 53]",1079485,en,Winnie-the-Pooh: Blood and Honey 2,"Five months following the murders, Christopher Robin struggles to maintain a regular life while dealing with PTSD. However, deep within the 100-Acre-Wood, a destructive rage grows as Pooh, Piglet, Owl, and Tigger find their home and their lives endangered after their existence is revealed.",464.854,/2sADrLwMQof6yYmrJRSa04tFZuS.jpg,2024-03-26,Winnie-the-Pooh: Blood and Honey 2,False,6.198,262
False,/hu6bwaSRG8GZwH3yEVtRxrgAnjq.jpg,"[16, 10751, 35, 10402, 10770]",929563,en,Big City Greens the Movie: Spacecation,"When thrill-seeker Cricket tricks his family into taking a ""road trip"" in space, chaos in the cosmos quickly ensues. Despite growing frustrations between Cricket and his dad, Bill, the two must learn to appreciate each other's unique perspectives in order to prevent Big City from being destroyed by an interstellar disaster.",446.604,/wV0nNtlL0nxgse8llRi7SypkCQI.jpg,2024-06-06,Big City Greens the Movie: Spacecation,False,8.2,16
False,/2fxnTXr8NwyTFkunkimJkGkhqfy.jpg,"[18, 28, 27]",1118031,es,Apocalipsis Z: el principio del fin,"When a kind of rabies that transforms people into aggressive creatures spreads across the planet, Manel isolates himself at home with his cat, relying on his wits to survive; but soon they must go out in search of food, by land and by sea, dodging many dangers.",513.814,/hSmOrZl8ON2aJk6xvjNgVQiPdCP.jpg,2024-10-04,Apocalypse Z: The Beginning of the End,False,6.6,159
False,/oBmwaZ3NVa3JyZnv1qCo0znxjUw.jpg,"[80, 27, 53]",1029281,en,Strange Darling,Nothing is what it seems when a twisted one-night stand spirals into a serial killer’s vicious murder spree.,382.742,/kWNCRgt3ocv19bYO0sk7TRuZuFY.jpg,2024-08-22,Strange Darling,False,7.032,187
False,,"[27, 53]",1320786,en,Terrifier 4,Plot TBA. The fourth installment in the Terrifier franchise.,431.229,/2p5KjqH3Qo5JI2u8bUAVopzoekm.jpg,,Terrifier 4,False,0.0,0
False,/tPfXJcXxQ3MHyvhzNsDgsXoyPEM.jpg,"[27, 9648]",1249532,en,Rippy,"Young police officer Maddy is determined to live up to her deceased father's legacy. Her courage is put to the test when locals are found brutally ripped to shreds by the zombie kangaroo. As the undead beast leaves a trail of carnage, Maddy, with the help of her eccentric Uncle Schmitty and resilient Aunt Donna, must embark on a high-stakes battle to save the town.",417.807,/cZ5U4Ae74g29E02JR5oR98RQhiR.jpg,2024-10-25,Rippy,False,4.5,16
False,/5tqkP8NNWdteskVBYPRXE6h82ts.jpg,[18],592695,sv,Pleasure,"19 year old Linnéa leaves her small town in Sweden and heads for Los Angeles with the aim of becoming the world's next big porn star, but the road to her goal turns out to be bumpier than she imagined.",416.976,/7Z2K08J0WantJHNa0vLTOmii41l.jpg,2021-10-08,Pleasure,False,6.2,539
False,/bEJyUUygNSLhe4BPykEHf3hPnsh.jpg,"[28, 53]",1145491,en,Operation Black Ops,"A group of mercenaries are hired to overthrow a Neo-Nazi stronghold nestled deep in the heart of Texas, only to discover they are protecting nuclear codes that could ignite World War III.",415.78,/vMgkjQM2fHirExilsTZWJTqL33G.jpg,2023-07-11,Operation Black Ops,False,5.71,31
False,/xWT5F1DNxciNLEMXRl49iq8zvN7.jpg,"[14, 16, 10751]",9479,en,The Nightmare Before Christmas,"Tired of scaring humans every October 31 with the same old bag of tricks, Jack Skellington, the spindly king of Halloween Town, kidnaps Santa Claus and plans to deliver shrunken heads and other ghoulish gifts to children on Christmas morning. But as Christmas approaches, Jack's rag-doll girlfriend, Sally, tries to foil his misguided plans.",325.729,/oQffRNjK8e19rF7xVYEN8ew0j7b.jpg,1993-10-09,The Nightmare Before Christmas,False,7.8,9458
False,/l8OyAXEp5FKZWmDhqJMbiwAEvz.jpg,"[27, 18]",814889,en,Never Let Go,"As an evil takes over the world beyond their front doorstep, the only protection for a mother and her twin sons is their house and their family’s protective bond.",399.565,/3EpZ2ksjijmdr8BhISP03PYzNFW.jpg,2024-09-18,Never Let Go,False,6.2,168
False,/g1z1ZvYKcmk9EnVOTYXR6vkNjkZ.jpg,"[14, 27, 28]",1087822,en,Hellboy: The Crooked Man,"Hellboy and a rookie BPRD agent get stranded in 1950s rural Appalachia. There, they discover a small community haunted by witches, led by a local devil with a troubling connection to Hellboy's past: the Crooked Man.",459.1,/iz2GabtToVB05gLTVSH7ZvFtsMM.jpg,2024-08-29,Hellboy: The Crooked Man,False,5.4,245
False,/vGaBqgY8YRzQVUbBMPnd5SmYvL7.jpg,"[16, 35]",1329336,en,The Bad Guys: Haunted Heist,The crafty Bad Guys crew embarks on a high-stakes Halloween heist to swipe a priceless amulet from a spooky mansion. What could go wrong?,398.095,/oEJC05CqPugMxC4rFu9r6r6vg6m.jpg,2024-10-02,The Bad Guys: Haunted Heist,False,7.318,74
False,/sLp1vdiIQoLgLYsOb9ebDbBYB7D.jpg,"[12, 35, 14, 28]",1091181,fr,Loups-Garous,"When an old card game comes to life, a family jumps back in time to a medieval village where they must unmask werewolves to secure their return home.",375.057,/uL1dR0L65GZgy3h2gvZcxDu0bRG.jpg,2024-10-22,Family Pack,False,5.7,227
False,/nxxCPRGTzxUH8SFMrIsvMmdxHti.jpg,"[35, 14, 10751]",639720,en,IF,A young girl who goes through a difficult experience begins to see everyone's imaginary friends who have been left behind as their real-life friends have grown up.,378.505,/xbKFv4KF3sVYuWKllLlwWDmuZP7.jpg,2024-05-08,IF,False,7.3,975
False,/4z88bpDf7aqZcYkLDDEIdj8TfZU.jpg,"[16, 10751, 14, 28]",1011985,en,Kung Fu Panda 4,"Po is gearing up to become the spiritual leader of his Valley of Peace, but also needs someone to take his place as Dragon Warrior. As such, he will train a new kung fu practitioner for the spot and will encounter a villain called the Chameleon who conjures villains from the past.",413.496,/kDp1vUBnMpe8ak4rjgl3cLELqjU.jpg,2024-03-02,Kung Fu Panda 4,False,7.091,2662
