adult,backdrop_path,genre_ids,id,original_language,original_title,overview,popularity,poster_path,release_date,title,video,vote_average,vote_count
False,/5IGIFbHmRLWaAvaJ7DYen2jiJHW.jpg,"[53, 9648, 18, 80]",1148172,hi,दो पत्ती,A puzzling investigation leads a no-nonsense cop down a dark path involving the vicious rivalry between twin sisters and the volatile man they both love.,264.73,/cRL004ik3BfI1lNWAxIJyOyMJsY.jpg,2024-10-24,Do Patti,False,6.9,19
False,/wFn1yJnuMOh8M3EonYchPH5XyjC.jpg,"[27, 35]",1308546,en,Carved,"On Halloween 1993, 2 years after a deadly nuclear spill, the staff of a historic pioneer village attraction must work together to survive the attack of a monstrous killer pumpkin set on revenge.",264.192,/9DKH4j80eR4qAcGDoShlUO7D0Is.jpg,2024-10-21,Carved,False,5.109,32
False,/iIvjwrDPQHCU4NjbbKpNs88uk6G.jpg,"[28, 35]",1048241,en,My Spy The Eternal City,"JJ, a veteran CIA agent, reunites with his protégé Sophie, in order to prevent a catastrophic nuclear plot targeting the Vatican.",261.877,/Bf3vCfM94bSJ1saZlyi0UW0e0U.jpg,2024-07-18,My Spy The Eternal City,False,6.635,311
False,/7I6VUdPj6tQECNHdviJkUHD2u89.jpg,"[28, 53, 80]",603692,en,John Wick: Chapter 4,"With the price on his head ever increasing, John Wick uncovers a path to defeating The High Table. But before he can earn his freedom, Wick must face off against a new enemy with powerful alliances across the globe and forces that turn old friends into foes.",259.85,/vZloFAK7NmvMGKE7VkF5UHaz0I.jpg,2023-03-22,John Wick: Chapter 4,False,7.733,6455
False,/tDOVQe5RFwd9l8Es7A0EOqzo011.jpg,"[27, 28, 14, 53]",901060,en,Seven Cemeteries,A recent parolee gets a Mexican witch to resurrect his old posse so that they can help him save a woman's ranch from a ruthless drug lord.,258.954,/jHdmMiS35fN0zLJBXNg3VHLJk9y.jpg,2024-10-11,Seven Cemeteries,False,5.1,6
False,/tqSg1hHiSWhHAhnjDhhevaFGsP0.jpg,"[28, 18]",1066262,en,The Convert,"Munro, a soldier turned lay preacher, comes to New Zealand to minister to the first British colonists, but he is converted by the powerful chief Maianui to serve a different purpose.",258.209,/e5ZqqPlhKstzB4geibpZh38w7Pq.jpg,2024-03-14,The Convert,False,6.2,93
False,/8VS20PnbTc6Aza1ZjCxit9os3KD.jpg,[27],1207898,en,The Jack in the Box: Rises,"When a creepy Jack-in-the-Box is discovered and opened on the grounds of an exclusive girls' school, six brave students soon enter a fight to the finish against the unleashed demon.",256.29,/uLEL4AxKOn6pZQAF3gWXbqSkhIo.jpg,2024-01-18,The Jack in the Box: Rises,False,6.9,135
False,/fagaywgTkMpIdoRLtJF2GvwrqXI.jpg,"[878, 18]",1244880,es,Invasión,Three stories intertwine to form a vision of war in a narrative kaleidoscope that transcends space and time. The seven characters of the play will face their own internal enemies and find the only way to escape in love.,254.559,/poZZC9PNg554tLA4nJWvc3gYIaJ.jpg,2024-06-28,Invasión,False,7.0,2
False,/m5dA4JZsj78EBTa2D6imWOAebwB.jpg,[35],4247,en,Scary Movie,"A familiar-looking group of teenagers find themselves being stalked by a more-than-vaguely recognizable masked killer! As the victims begin to pile up and the laughs pile on, none of your favorite scary movies escape the razor-sharp satire of this outrageously funny parody!",254.24,/fVQFPRuw3yWXojYDJvA5EoFjUOY.jpg,2000-07-07,Scary Movie,False,6.4,6898
False,/AowNXLFNKWDRYBKHLsgTK0T7Bxf.jpg,"[28, 35, 80]",1210794,sv,Strul,"Wrongfully convicted of murder, a clumsy electronics salesman faces police corruption and criminal conspiracies in an attempt to prove his innocence.",254.084,/ildbg7ho14EHbt1fZWAkgqIyPqy.jpg,2024-10-02,Trouble,False,6.9,106
False,/hofnlIyF6bePkgQOpcuRWLvzf15.jpg,"[16, 10751, 14]",14836,en,Coraline,"Wandering her rambling old house in her boring new town, 11-year-old Coraline discovers a hidden door to a strangely idealized version of her life. In order to stay in the fantasy, she must make a frighteningly real sacrifice.",250.543,/4jeFXQYytChdZYE9JYO7Un87IlW.jpg,2009-02-05,Coraline,False,7.9,8014
False,/UJje4GZglCtC8ZtYY8T4jj1RHm.jpg,"[18, 10749]",72808,it,La carne,"A beautiful film which is basically about a man, a piano player, who meets and falls in love with a beautiful and voluptuous woman, who, by some strange procedure, leaves the man unable to move but with a permanent priapism! After some time he becomes sick of it and she relieves his paralysis. Eventually she gets bored and decides to leave, but he can't take it because he loves her…",249.876,/quhlqvkeRZN6tZrDSfJ41en6CDs.jpg,1991-05-09,The Flesh,False,5.4,46
False,/k0hlAzTryCYX1O1LyC6P8tAa8s0.jpg,"[28, 12, 878]",102382,en,The Amazing Spider-Man 2,"For Peter Parker, life is busy. Between taking out the bad guys as Spider-Man and spending time with the person he loves, Gwen Stacy, high school graduation cannot come quickly enough. Peter has not forgotten about the promise he made to Gwen’s father to protect her by staying away, but that is a promise he cannot keep. Things will change for Peter when a new villain, Electro, emerges, an old friend, Harry Osborn, returns, and Peter uncovers new clues about his past.",249.827,/kV61FAIsRWZP6JhgWFOKug9RbBx.jpg,2014-04-16,The Amazing Spider-Man 2,False,6.5,13153
False,/dn3gbDpXPSwC6saMJOHkCiFA9jn.jpg,"[14, 12, 10751, 35]",974262,en,Descendants: The Rise of Red,"After the Queen of Hearts incites a coup on Auradon, her rebellious daughter Red and Cinderella's perfectionist daughter Chloe join forces and travel back in time to try to undo the traumatic event that set Red's mother down her villainous path.",248.012,/8fYluTtB3b3HKO7KQa5tzrvGaps.jpg,2024-07-11,Descendants: The Rise of Red,False,7.0,359
False,/69zQPqavgtWhpvWS5dOU0sInjez.jpg,[18],1362101,tr,Mavi Mağara,"When Cem finds himself at the brink of losing the love of his life, Alara, he embarks on an expedition to the Blue Cave, Alara's most beloved archeological site, to feel close to her again.",247.22,/32hWYgxMOudSgA6tR8nlVTUtoOi.jpg,2024-10-17,Blue Cave,False,6.9,38
False,/nlG452icactoT6hbqECbSEVfGII.jpg,"[16, 12, 35, 10751, 14]",228326,en,The Book of Life,"The journey of Manolo, a young man who is torn between fulfilling the expectations of his family and following his heart. Before choosing which path to follow, he embarks on an incredible adventure that spans three fantastical worlds where he must face his greatest fears.",247.1,/aotTZos5KswgCryEzx2rlOjFsm1.jpg,2014-10-01,The Book of Life,False,7.544,2662
False,/yjPXIgY3QoHe8Kt8nEJCz97UF3q.jpg,"[36, 18, 10752]",832964,en,Lee,"The true story of photographer Elizabeth 'Lee' Miller, a fashion model who became an acclaimed war correspondent for Vogue magazine during World War II.",246.885,/zdNWyuim8gpJHe1LtKaDrs43dWz.jpg,2024-09-12,Lee,False,6.947,141
False,/4XM8DUTQb3lhLemJC51Jx4a2EuA.jpg,"[28, 80, 53]",385687,en,Fast X,"Over many missions and against impossible odds, Dom Toretto and his family have outsmarted, out-nerved and outdriven every foe in their path. Now, they confront the most lethal opponent they've ever faced: A terrifying threat emerging from the shadows of the past who's fueled by blood revenge, and who is determined to shatter this family and destroy everything—and everyone—that Dom loves, forever.",246.738,/fiVW06jE7z9YnO4trhaMEdclSiC.jpg,2023-05-17,Fast X,False,7.082,5542
False,/tQs7iqsL1szbLZlI99eXVRxDIYB.jpg,[27],1139095,en,Little Bites,"Mindy, a young widow and mother who tries to protect her daughter Alice from a flesh eating monster named Agyar. Mindy has been secretly sacrificing her own life by allowing the creature to feast on her body as she keeps Alice hidden away at her grandmother’s house.",242.643,/11WUy1jqjk2ZMj5UjvfmBAIYDvr.jpg,2024-10-04,Little Bites,False,6.4,24
False,/cnUpZo6sNTdfbFx7ufs7ubi5MWX.jpg,"[18, 10749, 35]",1064213,en,Anora,"Anora, a young sex worker from Brooklyn, gets her chance at a Cinderella story when she meets and impulsively marries the son of an oligarch. Once the news reaches Russia, her fairytale is threatened as the parents set out for New York to get the marriage annulled.",242.621,/xXz6ScxPlLRzL3MtzceNY52Neuq.jpg,2024-10-11,Anora,False,7.511,93
False,/tqSg1hHiSWhHAhnjDhhevaFGsP0.jpg,"[28, 18]",1066262,en,The Convert,"Munro, a soldier turned lay preacher, comes to New Zealand to minister to the first British colonists, but he is converted by the powerful chief Maianui to serve a different purpose.",258.209,/e5ZqqPlhKstzB4geibpZh38w7Pq.jpg,2024-03-14,The Convert,False,6.2,93
False,/mbc28jv0sj0Q4fk0kcO2zasQkO6.jpg,"[10770, 35, 10749, 18]",1359867,en,The Christmas Charade,"A cautious librarian raised by home security experts finds herself in a real-life adventure when a blind date mix-up leads her into an undercover FBI operation. Forced to pose as the girlfriend of Special Agent Josh, she helps him track down an art thief targeting the Saint Nicholas Ruby at a Christmas Eve charity ball.",350.279,/1jgFIqG7haKpxXnckzTw9pzlG4v.jpg,2024-10-26,The Christmas Charade,False,6.7,5
False,/viKEEaaCaZ0hZ2nGuvIEozlLooL.jpg,"[27, 9648, 53]",1023922,en,MaXXXine,"In 1980s Hollywood, adult film star and aspiring actress Maxine Minx finally gets her big break. But as a mysterious killer stalks the starlets of Hollywood, a trail of blood threatens to reveal her sinister past.",286.292,/ArvoFK6nlouZRxYmtIOUzKIrg90.jpg,2024-07-04,MaXXXine,False,6.4,733
False,/1aOPPkXASkd2By3EKIw66Ilx5qF.jpg,"[28, 53]",1094974,en,Take Cover,A burned-out professional sniper finds himself trapped in an all-glass penthouse by a lethal competitor and must find a way to survive and escape with little to no cover between him and the killer.,351.632,/xNLiMNyFzKTL9PVIEulG55Hei8j.jpg,2024-10-04,Take Cover,False,6.737,38
False,/hU1Q9YVzdYhokr8a9gLywnSUMlN.jpg,"[16, 12, 28, 14, 10751]",1147400,fr,"Miraculous World : Paris, Les Aventures de Toxinelle et Griffe Noire","Miraculous holders from another world appear in Paris. They come from a parallel universe where everything is reversed: the holders of Ladybug and Black Cat Miraculouses, Shadybug and Claw Noir, are the bad guys, and the holder of the Butterfly Miraculous, Hesperia, is a superhero. Ladybug and Cat Noir will have to help Hesperia counter the attacks of their evil doubles and prevent them from seizing the Butterfly's Miraculous. Can our heroes also help Hesperia make Shadybug and Claw Noir better people?",226.472,/7Md3nuV0ZprBTnkdR3OrUCEsrSP.jpg,2023-10-21,"Miraculous World: Paris, Tales of Shadybug and Claw Noir",False,7.2,504
False,/tcn8pfSvqntCHrjgHRYlP7b8pUX.jpg,[28],360778,ja,くノ一忍法帖 IV 忠臣蔵秘抄,"The female ninjas have to stop an alliance from carrying out their dastardly deeds, which includes bizarre ninjitsu sex magic to aid them in their quest.",149.382,/7TyWl7VX3dvKxPJUTsu4h9Yh8Az.jpg,1994-03-24,Female Ninjas Magic Chronicles 4: Rebel Forces at the Threshold,False,3.3,3
False,/7cjrEMDo2xDT95fvCNb0CssokxZ.jpg,"[16, 35]",1358947,en,The Most Wonderful Time of the Year,"Sideshow Bob teams up with the most infamous villains of Disney+ to share the true meaning of the Halloween season. Filled with music, mayhem, and madness, this short from ""The Simpsons"" is simply to die for.",221.117,/3ivqP56Jd8RkbDidoe1rGFVGpJZ.jpg,2024-10-11,The Most Wonderful Time of the Year,False,5.6,17
False,/hziiv14OpD73u9gAak4XDDfBKa2.jpg,"[12, 14]",671,en,Harry Potter and the Philosopher's Stone,"Harry Potter has lived under the stairs at his aunt and uncle's house his whole life. But on his 11th birthday, he learns he's a powerful wizard—with a place waiting for him at the Hogwarts School of Witchcraft and Wizardry. As he learns to harness his newfound powers with the help of the school's kindly headmaster, Harry uncovers the truth about his parents' deaths—and about the villain who's to blame.",230.976,/wuMc08IPKEatf9rnMNXvIDxqP4W.jpg,2001-11-16,Harry Potter and the Philosopher's Stone,False,7.914,27293
False,/cnUpZo6sNTdfbFx7ufs7ubi5MWX.jpg,"[18, 10749, 35]",1064213,en,Anora,"Anora, a young sex worker from Brooklyn, gets her chance at a Cinderella story when she meets and impulsively marries the son of an oligarch. Once the news reaches Russia, her fairytale is threatened as the parents set out for New York to get the marriage annulled.",242.621,/xXz6ScxPlLRzL3MtzceNY52Neuq.jpg,2024-10-11,Anora,False,7.505,92
False,/cyKH7pDFlxIXluqRyNoHHEpxSDX.jpg,"[80, 28, 53, 18]",646097,en,Rebel Ridge,A former Marine confronts corruption in a small town when local law enforcement unjustly seizes the bag of cash he needs to post his cousin's bail.,222.777,/xEt2GSz9z5rSVpIHMiGdtf0czyf.jpg,2024-08-27,Rebel Ridge,False,7.0,927
False,/jT4KqFTrR2ofpUUwzKCIn4uYWXp.jpg,"[28, 53]",1331375,en,Dominique,"Dominique, a well-trained assassin, flees from her troubled past in an attempt to begin a new life in South America. However, she soon finds herself in a town plagued with violence and corruption. Facing brutal attacks from the police and mafia, Dominique must decide whether to protect herself or an innocent family that has taken her in.",337.723,/29uKScAbQuKsMEdAn12a6BmvFn7.jpg,2024-10-11,Dominique,False,7.6,23
False,/zQKFPx03M9RKfEcRETXR2HoUZn1.jpg,[10749],587727,ko,가슴 큰 여자친구,"Mincheol and Suhee go to greet Minchul father (grandmother) before marriage. Dae - sik welcomes her daughter - in - law, Su - hee. But before marriage, Minchol and Suhee are separated by the difference in personality. Soon-hee, who was only preparing for marriage, is soon to live.",171.303,/f6PfAXtFEkJRcBtOjbzOgz8qqSK.jpg,2019-03-08,Busty Girlfriend,False,7.1,10
False,,"[53, 28]",1358752,es,Skinford 2: The Curse,,216.56,/auWtuSMLyiViVefPsj9JZA84n9I.jpg,2024-05-20,Skinford 2: The Curse,False,2.0,1
False,/18X5mXS1SpQy5rygEcpbmzUdkVP.jpg,"[18, 10751]",1186532,en,The Forge,"19 year old Isaiah Wright lives for basketball and video games. A year out of high school, he has no job, no plans, and no idea how to be a man. At odds with his single mother Cynthia, Isaiah is given an ultimatum – to step up or move out. Feeling the pull from his friends and the push from his mom, Isaiah is hired by Moore Fitness, unaware of how the owner will personally impact his life. With the prayers of his mother and unexpected guidance from his new mentor, Isaiah is forced to deal with his past, sacrifice his selfishness and discover how God might have a greater purpose for his life.",223.389,/vXW1I7HGZkeGUqw8QpGFiDA31Ih.jpg,2024-08-22,The Forge,False,8.137,131
False,/ncr6KR7bBF8cps6yZKiTAwClpn1.jpg,"[14, 35, 10751]",10439,en,Hocus Pocus,"After 300 years of slumber, three sister witches are accidentally resurrected in Salem on Halloween night, and it is up to three kids and their newfound feline friend to put an end to the witches' reign of terror once and for all.",331.764,/by4D4Q9NlUjFSEUA1yrxq6ksXmk.jpg,1993-07-16,Hocus Pocus,False,7.04,2997
False,/blqiNjJefmY10Wx6y2vgJJWljJj.jpg,"[28, 53]",949484,en,Hounds of War,"After a mission goes wrong, only one of a group of mercenaries is left alive to avenge his fallen brothers.",227.053,/lRBT73EWsiQPuqK3YS3BnBW0Zwi.jpg,2024-08-29,Hounds of War,False,6.43,100
False,/z62CBlBBBOoNUuuxZ1jMAcq5ARE.jpg,"[16, 10749, 14, 10751]",10198,en,The Princess and the Frog,"A waitress, desperate to fulfill her dreams as a restaurant owner, is set on a journey to turn a frog prince back into a human being, but she has to face the same problem after she kisses him.",182.291,/v6nAUs62OJ4DXmnnmPFeVmMz8H9.jpg,2009-12-08,The Princess and the Frog,False,7.215,5553
False,/3W6ifzDqxINcxsZQypwupTPue8m.jpg,"[10749, 18, 35]",323260,cn,鴨王,"Fung looks like a super-heartthrob and was bon with a special endowment, making him the high school idol. He was expelled from school when he was caught fighting on campus. When his mom, the sole provider of his family with her poultry business, had to stop working due to her back problems, Fung decides to support his family financially. And from that moment, his life takes on a tumultuous change…",206.584,/v0YIyJc5EtAGciCZsvqsW2QPRAr.jpg,2015-01-29,The Gigolo,False,5.0,29
False,/mDfJG3LC3Dqb67AZ52x3Z0jU0uB.jpg,"[12, 28, 878]",299536,en,Avengers: Infinity War,"As the Avengers and their allies have continued to protect the world from threats too large for any one hero to handle, a new danger has emerged from the cosmic shadows: Thanos. A despot of intergalactic infamy, his goal is to collect all six Infinity Stones, artifacts of unimaginable power, and use them to inflict his twisted will on all of reality. Everything the Avengers have fought for has led up to this moment - the fate of Earth and existence itself has never been more uncertain.",232.439,/7WsyChQLEftFiDOVTGkv3hFpyyt.jpg,2018-04-25,Avengers: Infinity War,False,8.244,29645
False,/kVd3a9YeLGkoeR50jGEXM6EqseS.jpg,"[16, 28, 12, 878]",569094,en,Spider-Man: Across the Spider-Verse,"After reuniting with Gwen Stacy, Brooklyn’s full-time, friendly neighborhood Spider-Man is catapulted across the Multiverse, where he encounters the Spider Society, a team of Spider-People charged with protecting the Multiverse’s very existence. But when the heroes clash on how to handle a new threat, Miles finds himself pitted against the other Spiders and must set out on his own to save those he loves most.",207.414,/8Vt6mWEReuy4Of61Lnj5Xj704m8.jpg,2023-05-31,Spider-Man: Across the Spider-Verse,False,8.4,6902
False,/2vFuG6bWGyQUzYS9d69E5l85nIz.jpg,"[878, 12, 28]",667538,en,Transformers: Rise of the Beasts,"When a new threat capable of destroying the entire planet emerges, Optimus Prime and the Autobots must team up with a powerful faction known as the Maximals. With the fate of humanity hanging in the balance, humans Noah and Elena will do whatever it takes to help the Transformers as they engage in the ultimate battle to save Earth.",220.342,/gPbM0MK8CP8A174rmUwGsADNYKD.jpg,2023-06-06,Transformers: Rise of the Beasts,False,7.3,4566
False,/iafs5DG5fGq7ef0acl3xlX4BFrs.jpg,"[18, 10770]",1219685,fr,Un père idéal,"Michel, the jovial owner of the only café in a small Normandy town, sees his life turned upside down when his teenage daughter is murdered. The community has his back but soon rumor spreads and Michel is singled out. From the ideal father, he becomes the ideal culprit.",169.984,/4xJd3uwtL1vCuZgEfEc8JXI9Uyx.jpg,2024-04-21,An Ideal Father,False,6.4,98
False,/p9uplKCEPJq4xGJPJJV46KW1dsA.jpg,"[10749, 18, 35]",1100099,en,We Live in Time,"An up-and-coming chef and a recent divorcée find their lives forever changed when a chance encounter brings them together, in a decade-spanning, deeply moving romance.",283.989,/flSncTaSISRqrqoJ18ZBmThR4Ee.jpg,2024-10-10,We Live in Time,False,8.1,31
False,/xOMo8BRK7PfcJv9JCnx7s5hj0PX.jpg,"[878, 12]",693134,en,Dune: Part Two,"Follow the mythic journey of Paul Atreides as he unites with Chani and the Fremen while on a path of revenge against the conspirators who destroyed his family. Facing a choice between the love of his life and the fate of the known universe, Paul endeavors to prevent a terrible future only he can foresee.",220.119,/1pdfLvkbY9ohJlCjQH2CZjjYVvJ.jpg,2024-02-27,Dune: Part Two,False,8.2,5509
False,/zfbjgQE1uSd9wiPTX4VzsLi0rGG.jpg,"[18, 80]",278,en,The Shawshank Redemption,"Imprisoned in the 1940s for the double murder of his wife and her lover, upstanding banker Andy Dufresne begins a new life at the Shawshank prison, where he puts his accounting skills to work for an amoral warden. During his long stretch in prison, Dufresne comes to be admired by the other inmates -- including an older prisoner named Red -- for his integrity and unquenchable sense of hope.",215.543,/9cqNxx0GxF0bflZmeSMuL5tnGzr.jpg,1994-09-23,The Shawshank Redemption,False,8.7,27053
False,/crSL7DkgwyLIaRRIb7xM2ejZbca.jpg,"[878, 10751, 35, 28, 12]",939243,en,Sonic the Hedgehog 3,"Sonic, Knuckles, and Tails reunite against a powerful new adversary, Shadow, a mysterious villain with powers unlike anything they have faced before. With their abilities outmatched in every way, Team Sonic must seek out an unlikely alliance in hopes of stopping Shadow and protecting the planet.",222.333,/mubt4bnVfpJ5lBMq93DidEuMkJr.jpg,2024-12-19,Sonic the Hedgehog 3,False,0.0,0
False,/ctMserH8g2SeOAnCw5gFjdQF8mo.jpg,"[35, 12]",346698,en,Barbie,"Barbie and Ken are having the time of their lives in the colorful and seemingly perfect world of Barbie Land. However, when they get a chance to go to the real world, they soon discover the joys and perils of living among humans.",200.917,/iuFNMS8U5cb6xfzi51Dbkovj7vM.jpg,2023-07-19,Barbie,False,7.0,9063
False,/9juRmk8QjcsUcbrevVu5t8VZy5G.jpg,"[28, 12, 80, 53]",923667,cn,九龍城寨之圍城,"In 1980s Hong Kong, troubled youth Chan Lok-kwun, a mainland refugee, struggles to survive in the Kowloon Walled City by joining underground fights. Betrayed by crime boss Mr. Big while trying to buy a fake ID, he steals drugs from him and seeks refuge in the Walled City, where he encounters Cyclone, a compassionate yet authoritative crime lord.",224.368,/h0tunBO4tMjvKVVG7fXqHgwOr5C.jpg,2024-04-23,Twilight of the Warriors: Walled In,False,6.52,199
False,/jeaf43W4Koo2tWYqHjp45vTx9ST.jpg,[18],390159,es,La invención de la carne,An unlikely relationship forms between two young patients in a hospital.,214.473,/zPbnEjLhOF1wYexwGPYcnb65rEJ.jpg,2009-01-01,The Invention of Flesh,False,4.2,4
False,/fNylhsI3u6NmTxeanFPDEwvT9GS.jpg,"[80, 18, 53]",835113,en,Woman of the Hour,"An aspiring actress crosses paths with a prolific serial killer in '70s LA when they're cast on an episode of ""The Dating Game.""",197.692,/nc9ZqrJFbcUdlMg9lxXXtJb24jU.jpg,2024-10-03,Woman of the Hour,False,6.6,341
False,/vbAIe8DgAfrhkfwK8uiujXQEIoZ.jpg,"[53, 9648, 18, 878]",863873,en,Caddo Lake,"When an 8-year-old girl mysteriously vanishes on Caddo Lake, a series of past deaths and disappearances begin to link together, forever altering a broken family’s history.",185.454,/sv1IoM6xlCdAoOzUmgB9XTnADC.jpg,2024-10-09,Caddo Lake,False,7.3,276
False,/fsPjwLROBhgIhOiEvXAfIOvlxW1.jpg,"[27, 18]",1054561,pt,Abraço de Mãe,A survival horror set in 1996 during one of the biggest tropical storms ever to hit Rio de Janeiro. Ana and her firefighter team must evacuate a nursing home at risk of its collapsing – but they soon find the mysterious residents in the house have other plans.,184.159,/zH3n5p2keYtdBWIqwKhVVLITneE.jpg,2024-10-03,A Mother's Embrace,False,6.375,16
False,/59vDC1BuEQvti24OMr0ZvtAK6R1.jpg,"[14, 12, 16, 10751]",10191,en,How to Train Your Dragon,"As the son of a Viking leader on the cusp of manhood, shy Hiccup Horrendous Haddock III faces a rite of passage: he must kill a dragon to prove his warrior mettle. But after downing a feared dragon, he realizes that he no longer wants to destroy it, and instead befriends the beast – which he names Toothless – much to the chagrin of his warrior father.",161.288,/92olhXYaIX6lvB8jwFz4OSfPaKq.jpg,2010-03-18,How to Train Your Dragon,False,7.83,12927
False,/cDJ61O1STtbWNBwefuqVrRe3d7l.jpg,"[12, 14, 28]",10195,en,Thor,"Against his father Odin's will, The Mighty Thor - a powerful but arrogant warrior god - recklessly reignites an ancient war. Thor is cast down to Earth and forced to live among humans as punishment. Once here, Thor learns what it takes to be a true hero when the most dangerous villain of his world sends the darkest forces of Asgard to invade Earth.",193.755,/prSfAi1xGrhLQNxVSUFh61xQ4Qy.jpg,2011-04-21,Thor,False,6.769,21027
False,/2wrdcWrAN53Pl7ahBWMIKMzXBFF.jpg,"[16, 28, 12, 14, 878]",1134424,th,นักรบมนตรา: ตำนานแปดดวงจันทร์,"A story inspired by the original RAMAYANA, retold in a futuristic universe, involving brave warriors who possess ancient powers from another dimension.",206.364,/sQE0VegwDa0GHjawfNRr1sFgVE2.jpg,2023-10-11,Mantra Warrior: The Legend of The Eight Moons,False,6.4,29
False,/NqqLef2ITlK8olXT4iFuUXFwSh.jpg,"[9648, 53, 27]",840705,en,Blink Twice,"When tech billionaire Slater King meets cocktail waitress Frida at his fundraising gala, he invites her to join him and his friends on a dream vacation on his private island. But despite the epic setting, beautiful people, ever-flowing champagne, and late-night dance parties, Frida can sense that there’s something sinister hiding beneath the island’s lush façade.",201.198,/lZGOK0I2DJSRlEPNOAFTSNxSjDD.jpg,2024-08-21,Blink Twice,False,6.792,758
False,/iwkWvcXcP8M4r9HLglhVEhgGyVu.jpg,"[28, 18, 27, 53]",1001311,fr,Sous la Seine,"In order to save Paris from an international bloodbath, a grieving scientist is forced to face her tragic past when a giant shark appears in the Seine.",205.055,/qZPLK5ktRKa3CL4sKRZtj8UlPYc.jpg,2024-06-04,Under Paris,False,6.0,1154
False,/zBG5Mg29NH9xxpWMMG7BIvKwYhL.jpg,"[10749, 18]",829557,pl,365 dni: Ten dzień,"Laura and Massimo are back and hotter than ever. But the reunited couple's new beginning is complicated by Massimo’s family ties and a mysterious man who enters Laura’s life to win her heart and trust, at any cost.",203.172,/7qU0SOVcQ8BTJLodcAlulUAG16C.jpg,2022-04-26,365 Days: This Day,False,5.864,1515
False,/tmU7GeKVybMWFButWEGl2M4GeiP.jpg,"[18, 80]",238,en,The Godfather,"Spanning the years 1945 to 1955, a chronicle of the fictional Italian-American Corleone crime family. When organized crime family patriarch, Vito Corleone barely survives an attempt on his life, his youngest son, Michael steps in to take care of the would-be killers, launching a campaign of bloody revenge.",228.063,/3bhkrj58Vtu7enYsRolD1fZdja1.jpg,1972-03-14,The Godfather,False,8.7,20546
