adult,backdrop_path,genre_ids,id,original_language,original_title,overview,popularity,poster_path,release_date,title,video,vote_average,vote_count
False,/xjotE7aFdZ0D8aGriYjFOtDayct.jpg,"[14, 12, 28, 10751, 10749]",102651,en,Maleficent,"A beautiful, pure-hearted young woman, Maleficent has an idyllic life growing up in a peaceable forest kingdom, until one day when an invading army threatens the harmony of the land. She rises to be the land's fiercest protector, but she ultimately suffers a ruthless betrayal – an act that begins to turn her heart into stone. Bent on revenge, Maleficent faces an epic battle with the invading King's successor and, as a result, places a curse upon his newborn infant Aurora. As the child grows, Maleficent realizes that Aurora holds the key to peace in the kingdom – and to Maleficent's true happiness as well.",305.36,/bDG3yei6AJlEAK3A5wN7RwFXQ7V.jpg,2014-05-28,Maleficent,False,7.095,13030
False,/xZ2we4gdiwQmg6D1w9qHlAm5yIf.jpg,"[35, 12, 14, 16, 10751]",10192,en,Shrek Forever After,"A bored and domesticated Shrek pacts with deal-maker Rumpelstiltskin to get back to feeling like a real ogre again, but when he's duped and sent to a twisted version of Far Far Away—where Rumpelstiltskin is king, ogres are hunted, and he and Fiona have never met—he sets out to restore his world and reclaim his true love.",195.421,/6HrfPZtKcGmX2tUWW3cnciZTaSD.jpg,2010-05-16,Shrek Forever After,False,6.4,7296
False,/kMZIMqEXO5MFd5Y1Ha2jZZF4pvF.jpg,"[27, 9648]",882598,en,Smile,"After witnessing a bizarre, traumatic incident involving a patient, Dr. Rose Cotter starts experiencing frightening occurrences that she can't explain.",198.173,/aPqcQwu4VGEewPhagWNncDbJ9Xp.jpg,2022-09-23,Smile,False,6.7,3142
False,/4BXIBNeYpKkOrYtRVXpGCwHj3Ve.jpg,"[10752, 18]",983044,no,Konvoi,"In 1942, a convoy of 35 civilian ships, carrying vital supplies from Iceland to the Soviet Union, faces deadly challenges in the Arctic. Despite Allied naval escort, catastrophic intelligence errors expose the convoy to relentless German air and naval attacks. In the brutal conditions, inexperienced civilian sailors fight for survival, with only 12 ships making it to their destination.",191.823,/3iUVHcDUhDe1lUBcPYtd919MJpb.jpg,2023-12-25,The Arctic Convoy,False,6.7,50
False,/9GzQ4bT6gdeq4fKMrzpJLwx40sI.jpg,"[878, 53, 27]",1042657,en,Latency,"When professional gamer Hana, who suffers from acute agoraphobia, receives new equipment that enhances her game, she begins to wonder if it is reading her mind – or controlling it.",300.577,/oeSUxCFa0LFsExzTvuz2wjaObyU.jpg,2024-06-14,Latency,False,5.5,30
False,/ulxlhYuVYzDNwnLt49AYjwUUowZ.jpg,[35],1362961,es,Intercambiadas,"One enchanted night, during a meteor shower, young Sebastián made a heartfelt wish: for his loving nanny, Lupe, to become his mother, for her warmth and care were what he longed for, unlike his busy mother, Paola. The stars listened, and in their mysterious way, granted his wish, exchanging the roles of the two women, leading to a whimsical adventure full of unexpected laughs and heartwarming chaos.",299.541,/AnvUGHyV21rJOG9KyJojJNHg3nA.jpg,2024-09-27,Intercambiadas,False,8.1,11
False,/61yrVrkOH75fUtExDZ4Hi0KqOmc.jpg,"[27, 53, 35]",1225377,en,The Mouse Trap,"It's Alex's 21st Birthday, but she's stuck at the amusement arcade on a late shift so her friends decide to surprise her, but a masked killer dressed as Mickey Mouse decides to play a game of his own with them which she must survive.",174.949,/3ovFaFeojLFIl5ClqhtgYMDS8sE.jpg,2024-08-23,The Mouse Trap,False,4.4,38
False,/aX1P75MWK5BzjqPh8fR8HQoX27s.jpg,"[18, 35]",1029955,en,Kinds of Kindness,"A triptych fable following a man without choice who tries to take control of his own life; a policeman who is alarmed that his wife who was missing-at-sea has returned and seems a different person; and a woman determined to find a specific someone with a special ability, who is destined to become a prodigious spiritual leader.",298.371,/8mmpltkcG9areafsQHXaURedno3.jpg,2024-05-30,Kinds of Kindness,False,6.578,730
False,/jf1V00dZdNkVfEq7VPk8frrlELk.jpg,"[27, 9648]",748230,en,Salem's Lot,Author Ben Mears returns to his childhood home of Jerusalem's Lot only to discover his hometown is being preyed upon by a bloodthirsty vampire.,176.467,/j7ncdqBVufydVzVtxmXu8Ago4ox.jpg,2024-10-03,Salem's Lot,False,6.279,348
False,/8xVvEvOrtxVSWN3wpIdHozozyMb.jpg,"[35, 18]",1218193,ca,Casa en flames,"Montse, divorced and with two children who have long since ignored her, has been preparing for a family reunion at her home on the Costa Brava. Nothing, absolutely nothing, will prevent her from enjoying one last weekend with her family.",167.667,/62XgBKjAcKP0xarT4zJeZZPmfGT.jpg,2024-06-28,A House On Fire,False,7.1,28
False,/j29ekbcLpBvxnGk6LjdTc2EI5SA.jpg,"[16, 10751, 12, 18, 35]",150540,en,Inside Out,"When 11-year-old Riley moves to a new city, her Emotions team up to help her through the transition. Joy, Fear, Anger, Disgust and Sadness work together, but when Joy and Sadness get lost, they must journey through unfamiliar places to get back home.",208.633,/2H1TmgdfNtsKlU9jKdeNyYL5y8T.jpg,2015-06-17,Inside Out,False,7.912,21872
False,/jfC2xCBD8a5QJNd5yY3q23E8i7U.jpg,"[28, 80, 18]",1186947,pt,Bandida - A Número Um,"At the age of nine, Rebeca is sold by her grandmother to the bookseller who ran Rocinha. Disputed by bicheiros and drug dealers, the community is going through changes in power. Rebeca becomes the wife of the chief drug dealer and, with the death of her partner, his successor. The electrifying trajectory of crime, violence, drugs and love of a female drug kingpin in Rocinha, Rio de Janeiro in the 1980s.",200.736,/rGS8SzheANVQicNba0GCE6w1XHb.jpg,2024-06-20,Outlaw,False,6.0,87
False,/ansCWyqoyjLEueDXOUZeLrQlZ9J.jpg,"[28, 80, 53]",1010161,en,The Clean Up Crew,"When a crime scene clean up crew discovers a briefcase full of money, they must out smart a criminal kingpin and corrupt FBI agents who want it back.",167.174,/oinz9e5xvcn0hDQZyWUGPJ0oVye.jpg,2024-09-12,The Clean Up Crew,False,5.1,5
False,/9n2tJBplPbgR2ca05hS5CKXwP2c.jpg,"[16, 10751, 12, 14, 35]",502356,en,The Super Mario Bros. Movie,"While working underground to fix a water main, Brooklyn plumbers—and brothers—Mario and Luigi are transported down a mysterious pipe and wander into a magical new world. But when the brothers are separated, Mario embarks on an epic quest to find Luigi.",203.107,/qNBAXBIQlnOThrVvA6mA2B5ggV6.jpg,2023-04-05,The Super Mario Bros. Movie,False,7.649,9068
False,/xKJTWGvheOMMlTHgrjN18KaD9Ra.jpg,"[27, 53]",1174618,en,Alice in Terrorland,"A recently bereaved teenage girl goes to live with her aunt in a secluded woodland house, unaware that sinister forces lurk within.",287.459,/5XJGvr8g9jkmN6KUIOQOj2iE6K4.jpg,2023-12-26,Alice in Terrorland,False,6.015,162
False,/xJHokMbljvjADYdit5fK5VQsXEG.jpg,"[12, 18, 878]",157336,en,Interstellar,The adventures of a group of explorers who make use of a newly discovered wormhole to surpass the limitations on human space travel and conquer the vast distances involved in an interstellar voyage.,187.185,/gEU2QniE6E77NI6lCU6MxlNBvIx.jpg,2014-11-05,Interstellar,False,8.442,35490
False,/aQCCpAIdWAp6wyFgjMry4okwrZo.jpg,"[27, 53]",138843,en,The Conjuring,"Paranormal investigators Ed and Lorraine Warren work to help a family terrorized by a dark presence in their farmhouse. Forced to confront a powerful entity, the Warrens find themselves caught in the most terrifying case of their lives.",174.738,/wVYREutTvI2tmxr6ujrHT704wGF.jpg,2013-07-18,The Conjuring,False,7.5,11470
False,/jr8tSoJGj33XLgFBy6lmZhpGQNu.jpg,"[16, 12, 14, 35, 10751]",315162,en,Puss in Boots: The Last Wish,"Puss in Boots discovers that his passion for adventure has taken its toll: He has burned through eight of his nine lives, leaving him with only one life left. Puss sets out on an epic journey to find the mythical Last Wish and restore his nine lives.",199.657,/kuf6dutpsT0vSVehic3EZIqkOBt.jpg,2022-12-07,Puss in Boots: The Last Wish,False,8.2,7703
False,/9ifX42tfIXLCXx7Kf52Nf6e38hb.jpg,[27],1331344,es,No Voltees,"When two siblings return to their childhood home, they are confronted by a violent, supernatural presence that dwells deep within their worst traumas.",175.094,/g3ZeqO6cNvr6cbfUn2FYZ7wAZ6f.jpg,2024-09-20,No Voltees,False,8.4,5
False,/uAfhsySkr1UzQg1zdg3dZQRz9Fd.jpg,"[16, 10751, 35]",10193,en,Toy Story 3,"Woody, Buzz, and the rest of Andy's toys haven't been played with in years. With Andy about to go to college, the gang find themselves accidentally left at a nefarious day care center. The toys must band together to escape and return home to Andy.",223.922,/AbbXspMOwdvwWZgVN0nabZq03Ec.jpg,2010-06-16,Toy Story 3,False,7.8,14585
False,/criPrxkTggCra1jch49jsiSeXo1.jpg,"[878, 12, 28]",609681,en,The Marvels,"Carol Danvers, aka Captain Marvel, has reclaimed her identity from the tyrannical Kree and taken revenge on the Supreme Intelligence. But unintended consequences see Carol shouldering the burden of a destabilized universe. When her duties send her to an anomalous wormhole linked to a Kree revolutionary, her powers become entangled with that of Jersey City super-fan Kamala Khan, aka Ms. Marvel, and Carol’s estranged niece, now S.A.B.E.R. astronaut Captain Monica Rambeau. Together, this unlikely trio must team up and learn to work in concert to save the universe.",164.962,/9GBhzXMFjgcZ3FdR9w3bUMMTps5.jpg,2023-11-08,The Marvels,False,6.072,2654
