adult,backdrop_path,genre_ids,id,original_language,original_title,overview,popularity,poster_path,release_date,title,video,vote_average,vote_count
False,/4mN2sHsGBR7NEQaUU34S6VAnj97.jpg,"[28, 53, 80]",1147710,ko,하이재킹,"Pilots Tae-in and Gyu-sik are set to fly to Gimpo. Under the guidance of flight attendant Ok-soon, passengers are busy boarding. However, shortly after takeoff, a homemade bomb explodes, turning the cabin into chaos.",411.968,/68jNkFi61MQjrJEqj2up5wZ4w5R.jpg,2024-06-21,Hijack 1971,False,6.1,68
False,/l8OyAXEp5FKZWmDhqJMbiwAEvz.jpg,"[27, 18]",814889,en,Never Let Go,"As an evil takes over the world beyond their front doorstep, the only protection for a mother and her twin sons is their house and their family’s protective bond.",399.565,/3EpZ2ksjijmdr8BhISP03PYzNFW.jpg,2024-09-18,Never Let Go,False,6.163,169
False,/vGaBqgY8YRzQVUbBMPnd5SmYvL7.jpg,"[16, 35]",1329336,en,The Bad Guys: Haunted Heist,The crafty Bad Guys crew embarks on a high-stakes Halloween heist to swipe a priceless amulet from a spooky mansion. What could go wrong?,398.095,/oEJC05CqPugMxC4rFu9r6r6vg6m.jpg,2024-10-02,The Bad Guys: Haunted Heist,False,7.3,75
False,/bkENfmxUY3UYsRLizJAhF5IQPvS.jpg,"[28, 80, 53]",1025596,en,Blood for Dust,"Reckless Ricky makes serious money dealing illegal weapons throughout the tri-state area and loves to flaunt it. Traveling salesman Cliff, covers the same territory Ricky runs guns through. Desperate to find some financial relief for his struggling family, Cliff agrees to partner with Ricky, to commit cross-state drug and gun deliveries for a mid-level American cartel boss John. When a simple exchange turns into a bloodbath after Ricky kills everyone in a territory grab, the pair find themselves in a pressure cooker situation where unlikely drug dealer Cliff must fight as hard as he can to stay alive.",390.025,/nvaCnkl8RilLhVAQXPFei0tqkqW.jpg,2024-04-19,Blood for Dust,False,5.8,45
False,/1wP1phHo2CROOqzv7Azs0MT5esU.jpg,"[16, 35, 10751, 12, 28]",748783,en,The Garfield Movie,"Garfield, the world-famous, Monday-hating, lasagna-loving indoor cat, is about to have a wild outdoor adventure! After an unexpected reunion with his long-lost father – scruffy street cat Vic – Garfield and his canine friend Odie are forced from their perfectly pampered life into joining Vic in a hilarious, high-stakes heist.",384.115,/p6AbOJvMQhBmffd0PIv0u8ghWeY.jpg,2024-04-30,The Garfield Movie,False,7.115,1062
False,/cX3Vs8pVD2FbFuFPkF7OMgswmq7.jpg,"[27, 53, 28]",975022,en,You’re Killing Me,"Eden goes to a coveted 'Heaven and Hell' party, hoping to get a letter of recommendation to an elite university from the wealthy parents of her classmate, but the party quickly turns into a fight for her life.",383.214,/tAnwQKYkRlXS6Lgaq5XQ7JqS58x.jpg,2023-04-07,You’re Killing Me,False,5.9,28
False,/oBmwaZ3NVa3JyZnv1qCo0znxjUw.jpg,"[80, 27, 53]",1029281,en,Strange Darling,Nothing is what it seems when a twisted one-night stand spirals into a serial killer’s vicious murder spree.,382.742,/kWNCRgt3ocv19bYO0sk7TRuZuFY.jpg,2024-08-22,Strange Darling,False,7.0,187
False,/nxxCPRGTzxUH8SFMrIsvMmdxHti.jpg,"[35, 14, 10751]",639720,en,IF,A young girl who goes through a difficult experience begins to see everyone's imaginary friends who have been left behind as their real-life friends have grown up.,378.505,/xbKFv4KF3sVYuWKllLlwWDmuZP7.jpg,2024-05-08,IF,False,7.3,975
False,/sLp1vdiIQoLgLYsOb9ebDbBYB7D.jpg,"[12, 35, 14, 28]",1091181,fr,Loups-Garous,"When an old card game comes to life, a family jumps back in time to a medieval village where they must unmask werewolves to secure their return home.",375.057,/uL1dR0L65GZgy3h2gvZcxDu0bRG.jpg,2024-10-22,Family Pack,False,5.7,228
False,/Al127H6f1RXpESdg0MGNL2g8mzO.jpg,"[16, 35, 878]",1359227,en,LEGO Marvel Avengers: Mission Demolition,"A young, aspiring hero and superhero fan inadvertently unleashes a powerful new villain looking to rid the world of the Avengers.",366.973,/k3LGf9afqmUZiAJ9nffBinpOhOI.jpg,2024-10-17,LEGO Marvel Avengers: Mission Demolition,False,6.9,48
False,/vZaIAIX5XcXLsF4jRSp5x7wsRzn.jpg,"[80, 28]",783110,ko,밀수,"During the 1970s, in Kunchon, there were women divers who were able to dive without equipment, including two best friends Choon-ja and Jin-sook, Jin-sook's brother and Hammer. They always collected seafood under water for living. But, as fewer factories started to be built near the beach, the women divers started to have trouble with what they were doing for living. Without any choice, the ship crews decided to join the smuggling business in the water to seek a way for their living. But the smuggling business in their village got too big for Jin-sook's family to handle and the peaceful village was gradually broken.",366.059,/j8Jx4vpBG258jPxd4o0kOLDwTvm.jpg,2023-07-26,Smugglers,False,6.6,45
False,/iHYh4cdO8ylA3W0dUxTDVdyJ5G9.jpg,"[878, 12, 28]",653346,en,Kingdom of the Planet of the Apes,"Several generations following Caesar's reign, apes – now the dominant species – live harmoniously while humans have been reduced to living in the shadows. As a new tyrannical ape leader builds his empire, one young ape undertakes a harrowing journey that will cause him to question all he's known about the past and to make choices that will define a future for apes and humans alike.",361.772,/gKkl37BQuKTanygYQG1pyYgLVgf.jpg,2024-05-08,Kingdom of the Planet of the Apes,False,7.11,3135
False,/1aOPPkXASkd2By3EKIw66Ilx5qF.jpg,"[28, 53]",1094974,en,Take Cover,A burned-out professional sniper finds himself trapped in an all-glass penthouse by a lethal competitor and must find a way to survive and escape with little to no cover between him and the killer.,351.632,/xNLiMNyFzKTL9PVIEulG55Hei8j.jpg,2024-10-04,Take Cover,False,6.737,38
False,/mbc28jv0sj0Q4fk0kcO2zasQkO6.jpg,"[10770, 35, 10749, 18]",1359867,en,The Christmas Charade,"A cautious librarian raised by home security experts finds herself in a real-life adventure when a blind date mix-up leads her into an undercover FBI operation. Forced to pose as the girlfriend of Special Agent Josh, she helps him track down an art thief targeting the Saint Nicholas Ruby at a Christmas Eve charity ball.",350.279,/1jgFIqG7haKpxXnckzTw9pzlG4v.jpg,2024-10-26,The Christmas Charade,False,6.7,5
False,/1fL2S8LKxCVE9KoPRBXeagmBtex.jpg,"[27, 53]",1114513,en,Speak No Evil,"When an American family is invited to spend the weekend at the idyllic country estate of a charming British family they befriended on vacation, what begins as a dream holiday soon warps into a snarled psychological nightmare.",347.874,/fDtkrO2OAF8LKQTdzYmu1Y7lCLB.jpg,2024-09-11,Speak No Evil,False,7.323,838
False,/mKOBdgaEFguADkJhfFslY7TYxIh.jpg,"[28, 878, 35]",365177,en,Borderlands,"Returning to her home planet, an infamous bounty hunter forms an unexpected alliance with a team of unlikely heroes. Together, they battle monsters and dangerous bandits to protect a young girl who holds the key to unimaginable power.",347.457,/3NPUQ6Ywayb5ES2IP1HWrDRt1Gc.jpg,2024-08-07,Borderlands,False,5.863,739
False,/64tinBsds1nVp4wOCgYhMbSgsRW.jpg,"[28, 18, 36]",1075676,ko,"전,란","In the Joseon Dynasty, two friends who grew up together — one the master and one the servant — reunite post-war as enemies on opposing sides.",343.587,/hg9OeaCRSpazrfqYyEFr6BDaZW8.jpg,2024-10-02,Uprising,False,7.256,82
False,/8mjYwWT50GkRrrRdyHzJorfEfcl.jpg,"[28, 12]",558449,en,Gladiator II,"Years after witnessing the death of the revered hero Maximus at the hands of his uncle, Lucius is forced to enter the Colosseum after his home is conquered by the tyrannical Emperors who now lead Rome with an iron fist. With rage in his heart and the future of the Empire at stake, Lucius must look to his past to find strength and honor to return the glory of Rome to its people.",341.074,/2cxhvwyEwRlysAmRH4iodkvo0z5.jpg,2024-11-13,Gladiator II,False,0.0,0
False,/jT4KqFTrR2ofpUUwzKCIn4uYWXp.jpg,"[28, 53]",1331375,en,Dominique,"Dominique, a well-trained assassin, flees from her troubled past in an attempt to begin a new life in South America. However, she soon finds herself in a town plagued with violence and corruption. Facing brutal attacks from the police and mafia, Dominique must decide whether to protect herself or an innocent family that has taken her in.",337.723,/29uKScAbQuKsMEdAn12a6BmvFn7.jpg,2024-10-11,Dominique,False,7.6,23
False,/vGZHjvyAcmD1mHg5kLwITCgh74U.jpg,"[16, 18, 10749, 14]",916192,ja,夏へのトンネル、さよならの出口,"Urashima Tunnel – Once you enter that tunnel, you can get whatever you want, but at a price. Kaoru Tohno, who seems to have an elusive personality and traumatic past, and Anzu Hanashiro, who is struggling to reconcile her ideal image and true-to-heart attitude, team up to investigate the Urashima Tunnel and get what they want. This is an unforgettable summer story of nostalgia and sprinting in a remote countryside.",336.47,/5AGA6pbBKXZTI8k1c6odx30JuQR.jpg,2022-09-09,"The Tunnel to Summer, the Exit of Goodbyes",False,7.7,165
False,/vmzauGqSgx25rzavUbuN6c5Vdfc.jpg,"[16, 12, 35, 10751]",1059264,en,The Inseparables,"The animated buddy movie follows the misadventures of Don, a runaway puppet with boundless imaginations, and DJ Doggy Dog, an abandoned plush looking for a friend, who cross paths in Central Park and team up against all odds for a epic friendship adventure in New York.",332.185,/dmftU2Rnmv9KTteMUwjalOuZHke.jpg,2023-09-01,The Inseparables,False,6.5,34
False,/ncr6KR7bBF8cps6yZKiTAwClpn1.jpg,"[14, 35, 10751]",10439,en,Hocus Pocus,"After 300 years of slumber, three sister witches are accidentally resurrected in Salem on Halloween night, and it is up to three kids and their newfound feline friend to put an end to the witches' reign of terror once and for all.",331.764,/by4D4Q9NlUjFSEUA1yrxq6ksXmk.jpg,1993-07-16,Hocus Pocus,False,7.04,2997
False,/zGLQmrmIB56kMZPnzqReIOBay1B.jpg,"[28, 35, 80]",507241,en,The Killer's Game,"When top hitman Joe Flood is diagnosed with a terminal illness, he decides to take matters into his own hands – by taking a hit out on himself. But when the very hitmen he hired also target his ex-girlfriend, he must fend off an army of assassin colleagues and win back the love of his life before it's too late.",327.759,/4bKlTeOUr5AKrLky8mwWvlQqyVd.jpg,2024-09-12,The Killer's Game,False,6.477,87
False,/xWT5F1DNxciNLEMXRl49iq8zvN7.jpg,"[14, 16, 10751]",9479,en,The Nightmare Before Christmas,"Tired of scaring humans every October 31 with the same old bag of tricks, Jack Skellington, the spindly king of Halloween Town, kidnaps Santa Claus and plans to deliver shrunken heads and other ghoulish gifts to children on Christmas morning. But as Christmas approaches, Jack's rag-doll girlfriend, Sally, tries to foil his misguided plans.",325.729,/oQffRNjK8e19rF7xVYEN8ew0j7b.jpg,1993-10-09,The Nightmare Before Christmas,False,7.8,9458
False,/3DptKbui4zE8qXWv07rh5BIujX3.jpg,[35],1255017,es,Caras vemos,"It follows an unconventional family who find themselves embroiled in a personality swap after little Zoe has a mystical encounter with an ancient god. As a result, each family member finds themselves in the body of another.",322.537,/xohRCoJS9kNKal3MhFBNO3060YR.jpg,2024-08-22,Caras vemos,False,6.9,7
False,/iURqo6oIwbeegIwWXx5qrBsDcPk.jpg,"[10751, 12, 14, 35]",826510,en,Harold and the Purple Crayon,"Inside of his book, adventurous Harold can make anything come to life simply by drawing it. After he grows up and draws himself off the book's pages and into the physical world, Harold finds he has a lot to learn about real life.",320.267,/qtW6bWUEqfPLaD6KnetIlSG4adf.jpg,2024-07-31,Harold and the Purple Crayon,False,7.1,176
False,/vHJlbhsXrZ5yrO2KqCbGSIU6fRX.jpg,"[28, 9648, 878, 53]",198663,en,The Maze Runner,"Set in a post-apocalyptic world, young Thomas is deposited in a community of boys after his memory is erased, soon learning they're all trapped in a maze that will require him to join forces with fellow “runners” for a shot at escape.",318.427,/ode14q7WtDugFDp78fo9lCsmay9.jpg,2014-09-10,The Maze Runner,False,7.188,16921
False,/6XjMwQTvnICBz6TguiDKkDVHvgS.jpg,"[27, 878, 53]",762441,en,A Quiet Place: Day One,"As New York City is invaded by alien creatures who hunt by sound, a woman named Sam fights to survive with her cat.",315.413,/hU42CRk14JuPEdqZG3AWmagiPAP.jpg,2024-06-26,A Quiet Place: Day One,False,6.8,2061
False,/qwK9soQmmJ7kRdjLZVXblw3g7AQ.jpg,"[28, 12, 53, 80]",7451,en,xXx,"Xander Cage is your standard adrenaline junkie with no fear and a lousy attitude. When the US Government ""recruits"" him to go on a mission, he's not exactly thrilled. His mission: to gather information on an organization that may just be planning the destruction of the world, led by the nihilistic Yorgi.",314.323,/xeEw3eLeSFmJgXZzmF2Efww0q3s.jpg,2002-08-09,xXx,False,5.934,4239
False,/2KGxQFV9Wp1MshPBf8BuqWUgVAz.jpg,"[16, 28, 12, 35, 10751]",940551,en,Migration,"After a migrating duck family alights on their pond with thrilling tales of far-flung places, the Mallard family embarks on a family road trip, from New England, to New York City, to tropical Jamaica.",313.645,/ldfCF9RhR40mppkzmftxapaHeTo.jpg,2023-12-06,Migration,False,7.436,1776
False,/r9oTasGQofvkQY5vlUXglneF64Z.jpg,"[28, 35]",1029575,en,The Family Plan,"Dan Morgan is many things: a devoted husband, a loving father, a celebrated car salesman. He's also a former assassin. And when his past catches up to his present, he's forced to take his unsuspecting family on a road trip unlike any other.",311.68,/jLLtx3nTRSLGPAKl4RoIv1FbEBr.jpg,2023-12-14,The Family Plan,False,7.267,1354
False,/7aPrv2HFssWcOtpig5G3HEVk3uS.jpg,"[53, 28]",718821,en,Twisters,"As storm season intensifies, the paths of former storm chaser Kate Carter and reckless social-media superstar Tyler Owens collide when terrifying phenomena never seen before are unleashed. The pair and their competing teams find themselves squarely in the paths of multiple storm systems converging over central Oklahoma in the fight of their lives.",307.725,/pjnD08FlMAIXsfOLKQbvmO0f0MD.jpg,2024-07-10,Twisters,False,7.0,1684
False,/tElnmtQ6yz1PjN1kePNl8yMSb59.jpg,"[16, 12, 10751, 35]",1241982,en,Moana 2,"After receiving an unexpected call from her wayfinding ancestors, Moana journeys alongside Maui and a new crew to the far seas of Oceania and into dangerous, long-lost waters for an adventure unlike anything she's ever faced.",307.008,/yh64qw9mgXBvlaWDi7Q9tpUBAvH.jpg,2024-11-27,Moana 2,False,0.0,0
False,/xjotE7aFdZ0D8aGriYjFOtDayct.jpg,"[14, 12, 28, 10751, 10749]",102651,en,Maleficent,"A beautiful, pure-hearted young woman, Maleficent has an idyllic life growing up in a peaceable forest kingdom, until one day when an invading army threatens the harmony of the land. She rises to be the land's fiercest protector, but she ultimately suffers a ruthless betrayal – an act that begins to turn her heart into stone. Bent on revenge, Maleficent faces an epic battle with the invading King's successor and, as a result, places a curse upon his newborn infant Aurora. As the child grows, Maleficent realizes that Aurora holds the key to peace in the kingdom – and to Maleficent's true happiness as well.",305.36,/bDG3yei6AJlEAK3A5wN7RwFXQ7V.jpg,2014-05-28,Maleficent,False,7.095,13030
False,/4CmxmxgiFdTaNmsscochV9rBcnF.jpg,"[27, 53]",1226578,en,Longlegs,"FBI Agent Lee Harker is assigned to an unsolved serial killer case that takes an unexpected turn, revealing evidence of the occult. Harker discovers a personal connection to the killer and must stop him before he strikes again.",305.258,/5aj8vVGFwGVbQQs26ywhg4Zxk2L.jpg,2024-05-31,Longlegs,False,6.7,1236
False,/8y9mgkTlaEUAtjrHr9akapFd6hQ.jpg,"[27, 9648, 36]",931944,de,Des Teufels Bad,"In 1750 Austria, a deeply religious woman named Agnes has just married her beloved, but her mind and heart soon grow heavy as her life becomes a long list of chores and expectations. Day after day, she is increasingly trapped in a murky and lonely path leading to evil thoughts, until the possibility of committing a shocking act of violence seems like the only way out of her inner prison.",304.568,/ycoXsJomPmPjtCfNweM0UWiTkPY.jpg,2024-03-08,The Devil's Bath,False,6.9,51
False,/co7oxvpWxgd6FZU24DnljDDHYQA.jpg,"[878, 53, 27]",1064028,en,Subservience,"With his wife out sick, a struggling father brings home a lifelike AI, only to have his self-aware new help want everything her new family has to offer... Like the affection of her owner and she'll kill to get it.",304.191,/gBenxR01Uy0Ev9RTIw6dVBPoyQU.jpg,2024-08-15,Subservience,False,6.713,225
False,/veIyxxi5Gs8gvztLEW1Ysb8rrzs.jpg,"[28, 12, 878]",823464,en,Godzilla x Kong: The New Empire,"Following their explosive showdown, Godzilla and Kong must reunite against a colossal undiscovered threat hidden within our world, challenging their very existence – and our own.",303.86,/z1p34vh7dEOnLDmyCrlUVLuoDzd.jpg,2024-03-27,Godzilla x Kong: The New Empire,False,7.156,3752
False,,"[10749, 18]",482600,ko,일본 엄마,"""Innocent face, D-cup breasts and perfect intercourse skills! Son, this is not your girlfriend anymore but your mother!""  Ki-ho brings Yuki from Japan to marry her. However, he starts cheating on her with his ex-girlfriend in Korea.  Min-cheol comforted Yuki and thought of her as his daughter-in-law, but one day he realizes he is looking at her as a woman.  In the end, Yuki and Min-cheol have intercourse without Ki-ho knowing...",302.275,/hq1EaYIqUNrPM3QFYAbnH2UHoX8.jpg,2017-02-09,Japanese Mom,False,6.1,26
False,/9GzQ4bT6gdeq4fKMrzpJLwx40sI.jpg,"[878, 53, 27]",1042657,en,Latency,"When professional gamer Hana, who suffers from acute agoraphobia, receives new equipment that enhances her game, she begins to wonder if it is reading her mind – or controlling it.",300.577,/oeSUxCFa0LFsExzTvuz2wjaObyU.jpg,2024-06-14,Latency,False,5.5,30
False,/wh1IhMWkW7u5c5bkzSGFylF9G8r.jpg,"[28, 80, 53]",1215162,en,Kill 'em All 2,"Phillip and Suzanne are retired from the spy game, living peacefully off the grid. That's until their whereabouts are discovered by Vlad, the vengeful brother of their target from the first film.",299.602,/hgA5hN3NjNNSTXYOmAI6KNKOzbp.jpg,2024-09-24,Kill 'em All 2,False,6.788,113
False,/ulxlhYuVYzDNwnLt49AYjwUUowZ.jpg,[35],1362961,es,Intercambiadas,"One enchanted night, during a meteor shower, young Sebastián made a heartfelt wish: for his loving nanny, Lupe, to become his mother, for her warmth and care were what he longed for, unlike his busy mother, Paola. The stars listened, and in their mysterious way, granted his wish, exchanging the roles of the two women, leading to a whimsical adventure full of unexpected laughs and heartwarming chaos.",299.541,/AnvUGHyV21rJOG9KyJojJNHg3nA.jpg,2024-09-27,Intercambiadas,False,8.1,11
False,/aX1P75MWK5BzjqPh8fR8HQoX27s.jpg,"[18, 35]",1029955,en,Kinds of Kindness,"A triptych fable following a man without choice who tries to take control of his own life; a policeman who is alarmed that his wife who was missing-at-sea has returned and seems a different person; and a woman determined to find a specific someone with a special ability, who is destined to become a prodigious spiritual leader.",298.371,/8mmpltkcG9areafsQHXaURedno3.jpg,2024-05-30,Kinds of Kindness,False,6.6,731
False,/l0YYwVi7tIcuSGc3ssxTL5kfiHi.jpg,"[53, 18]",1364082,en,Hijack '93,"In an effort to dismantle their military-backed government, four men hijack an airplane, leveraging passengers onboard in the name of social change.",294.525,/g7Y1qXuXY6cyf44dBMVRYrx6Uyy.jpg,2024-10-24,Hijack '93,False,5.4,17
False,/x2RS3uTcsJJ9IfjNPcgDmukoEcQ.jpg,"[12, 14, 28]",120,en,The Lord of the Rings: The Fellowship of the Ring,"Young hobbit Frodo Baggins, after inheriting a mysterious ring from his uncle Bilbo, must leave his home in order to keep it from falling into the hands of its evil creator. Along the way, a fellowship is formed to protect the ringbearer and make sure that the ring arrives at its final destination: Mt. Doom, the only place where it can be destroyed.",290.048,/6oom5QYQ2yQTMJIbnvbkBL9cHo6.jpg,2001-12-18,The Lord of the Rings: The Fellowship of the Ring,False,8.417,25077
False,/xKJTWGvheOMMlTHgrjN18KaD9Ra.jpg,"[27, 53]",1174618,en,Alice in Terrorland,"A recently bereaved teenage girl goes to live with her aunt in a secluded woodland house, unaware that sinister forces lurk within.",287.459,/5XJGvr8g9jkmN6KUIOQOj2iE6K4.jpg,2023-12-26,Alice in Terrorland,False,6.015,162
False,/h9YlRHAZWOWtGonllmj6JJg1FrE.jpg,"[28, 12, 16, 10751, 14]",588648,zh,Dragonkeeper,"Set in Han Imperial China, the plot follows the adventures of enslaved girl Ping with ancient dragon Long Danzi. Dragons had been banished from the kingdom. Ping, an orphan, finds one of the last remaining dragon eggs. Palace guards force Ping to run away in order to return the dragon egg to the ocean and save all dragons from extinction. Ping discovers that she is a true Dragonkeeper.",287.319,/ggZGnJLzO3BTu7ysuuIzou3Oex5.jpg,2024-04-11,Dragonkeeper,False,7.346,120
False,/viKEEaaCaZ0hZ2nGuvIEozlLooL.jpg,"[27, 9648, 53]",1023922,en,MaXXXine,"In 1980s Hollywood, adult film star and aspiring actress Maxine Minx finally gets her big break. But as a mysterious killer stalks the starlets of Hollywood, a trail of blood threatens to reveal her sinister past.",286.292,/ArvoFK6nlouZRxYmtIOUzKIrg90.jpg,2024-07-04,MaXXXine,False,6.43,734
False,/wNAhuOZ3Zf84jCIlrcI6JhgmY5q.jpg,"[28, 878, 12]",786892,en,Furiosa: A Mad Max Saga,"As the world fell, young Furiosa is snatched from the Green Place of Many Mothers and falls into the hands of a great Biker Horde led by the Warlord Dementus. Sweeping through the Wasteland they come across the Citadel presided over by The Immortan Joe. While the two Tyrants war for dominance, Furiosa must survive many trials as she puts together the means to find her way home.",284.513,/iADOJ8Zymht2JPMoy3R7xceZprc.jpg,2024-05-22,Furiosa: A Mad Max Saga,False,7.541,3349
False,/p9uplKCEPJq4xGJPJJV46KW1dsA.jpg,"[10749, 18, 35]",1100099,en,We Live in Time,"An up-and-coming chef and a recent divorcée find their lives forever changed when a chance encounter brings them together, in a decade-spanning, deeply moving romance.",283.989,/flSncTaSISRqrqoJ18ZBmThR4Ee.jpg,2024-10-10,We Live in Time,False,8.1,31
False,/okVLmXL5y18dfN2R4ufMZEGaeCd.jpg,"[28, 80, 53, 18]",1160018,hi,किल,"When an army commando finds out his true love is engaged against her will, he boards a New Dehli-bound train in a daring quest to derail the arranged marriage. But when a gang of knife-wielding thieves begin to terrorize innocent passengers on his train, the commando takes them on himself in a death-defying kill-spree to save those around him — turning what should have been a typical commute into an adrenaline-fueled thrill ride.",282.491,/m2zXTuNPkywdYLyWlVyJZW2QOJH.jpg,2024-07-03,Kill,False,7.2,224
False,/en3GU5uGkKaYmSyetHV4csHHiH3.jpg,"[10752, 28, 18]",929590,en,Civil War,"In the near future, a group of war journalists attempt to survive while reporting the truth as the United States stands on the brink of civil war.",280.436,/sh7Rg8Er3tFcN9BpKIPOMvALgZd.jpg,2024-04-10,Civil War,False,6.9,2663
False,/igtm12Wy9EUlxFeyb4v8bRyuYSY.jpg,"[28, 80, 18, 53]",1337309,th,Bangkok Breaking: ฝ่านรกเมืองเทวดา,"When a dedicated rescue worker inadvertently gets caught up in the kidnapping plot of a mogul's tween daughter, he must save her from the clutches of rival gangs hunting them down with unpredictable dangers around every corner.",276.744,/6VeDn4oIeUK4XwjWGWMb6qvMImQ.jpg,2024-09-26,Bangkok Breaking: Heaven and Hell,False,6.646,41
False,/uXDwP5qPhuRyPpQ7WkLbE6t2z5W.jpg,"[35, 28, 80]",877817,en,Wolfs,"Hired to cover up a high-profile crime, a fixer soon finds his night spiralling out of control when he's forced to work with an unexpected counterpart.",275.889,/vOX1Zng472PC2KnS0B9nRfM8aaZ.jpg,2024-09-20,Wolfs,False,6.589,664
False,/n3JeGELHa9V6k9mL81ItMxWLSS6.jpg,"[28, 53, 27]",1129598,en,Prey,A young couple is compelled to leave their Christian missionary station in the Kalahari Desert after being threatened with death by an extremist militant gang. After crashing their aircraft they must battle man and beast for their lives.,274.593,/aOsPclgSiOqhndI2Xp2ksz2g9n6.jpg,2024-03-15,Prey,False,6.352,264
False,/eFlx3fW8FHXOktGa7Tzy57RajtG.jpg,"[18, 10749]",1357459,tl,Tatsulok: Tatlo Magkasalo,"Story about a happily married couple visited by an old friend, who ends up stirring the pot by becoming sexually involved with both the husband and the wife.",272.702,/zcmPxGIBxxsGVyYuzNWPCWjlQ8X.jpg,2024-10-11,Tatsulok: Tatlo Magkasalo,False,6.7,3
False,/hdFIdXwS8FSN2wIsuotjW1mshI0.jpg,"[16, 35, 12, 10751]",831815,en,Saving Bikini Bottom: The Sandy Cheeks Movie,"When Bikini Bottom is scooped from the ocean, scientific squirrel Sandy Cheeks and her pal SpongeBob SquarePants saddle up for Texas to save their town.",269.993,/30YnfZdMNIV7noWLdvmcJS0cbnQ.jpg,2024-10-18,Saving Bikini Bottom: The Sandy Cheeks Movie,False,6.769,26
False,/A7FKjE6jZyCnQRd4bOo7Yo0czLh.jpg,[35],55685,it,Avere vent'anni,"Lia and Tina are two beautiful girls who meet and realize that they have a lot in common. They are both young, beautiful and pissed off, so they decide to hitchhike their way to Rome to find Nazariota's commune, a place to stay for free and have all the sex they want... or so they think. Things don't go as they have planned though, and soon they become involved in prostitution, the police and an aggressive gang.",268.955,/6QXcWnq8Ln0uypX9y1e3r1wEpF.jpg,1978-07-14,To Be Twenty,False,5.8,71
False,/gZWl93sf8AxavYpVT1Un6EF3oCj.jpg,"[80, 53, 18]",475557,en,Joker,"During the 1980s, a failed stand-up comedian is driven insane and turns to a life of crime and chaos in Gotham City while becoming an infamous psychopathic crime figure.",268.513,/udDclJoHjfjb8Ekgsd4FDteOkCU.jpg,2019-10-01,Joker,False,8.149,25604
